

***** 1번 문제 *****



Microsoft Windows [Version 10.0.19042.928]
(c) Microsoft Corporation. All rights reserved.

C:\Users\CPB06GameN>mysql
ERROR 1045 (28000): Access denied for user 'ODBC'@'localhost' (using password: NO)

=== root id로 접속 ===


C:\Users\CPB06GameN>mysql -u root -p
Enter password: ****
Welcome to the MySQL monitor.  Commands end with ; or \g.
Your MySQL connection id is 54
Server version: 8.0.25 MySQL Community Server - GPL


== 새로운 유저 등록 ====

mysql> create user mymy@'%' identified by '7777';
Query OK, 0 rows affected (0.02 sec)


== 등록 유저에게 DB 권한 부여 ==

mysql> grant all privileges on mydb.* to mymy@'%' with grant option;
Query OK, 0 rows affected (0.01 sec)

mysql> flush privileges;
Query OK, 0 rows affected (0.01 sec)

==유저 등록된것 확인====

mysql> select user from user;
+------------------+
| user             |
+------------------+
| ace              |
| mymy             |
| mysql.infoschema |
| mysql.session    |
| mysql.sys        |
| root             |
+------------------+
6 rows in set (0.00 sec)


***** 2번 문제 *****

=== 새로운 아이디로 접속 성공 ===

C:\Users\CPB06GameN>mysql -u mymy -p
Enter password: ****
Welcome to the MySQL monitor.  Commands end with ; or \g.
Your MySQL connection id is 55
Server version: 8.0.25 MySQL Community Server - GPL

==== 새로운 테이블 및 필드명 생성 ====

mysql> create table oecd(nation char(30), population int, popratio int);
Query OK, 0 rows affected (0.04 sec)

===== 레코드 값 입력 ======

mysql>  insert into oecd values('USA', '318816000','4.39');
Query OK, 1 row affected (0.01 sec)

mysql>  insert into oecd values('SKorea', '50423955','0.69');
Query OK, 1 row affected (0.01 sec)

mysql>  insert into oecd values('Iran', '77775100','1.07');
Query OK, 1 row affected (0.01 sec)


====  모두 조회 ====


mysql> select * from oecd;
+--------+------------+----------+
| nation | population | popratio |
+--------+------------+----------+
| USA    |  318816000 |        4 |
| SKorea |   50423955 |        1 |
| Iran   |   77775100 |        1 |
+--------+------------+----------+
3 rows in set (0.00 sec)


====  usa 삭제 ====


mysql> delete from oecd where nation='USA';
Query OK, 1 row affected (0.01 sec)

mysql> select * from oecd;
+--------+------------+----------+
| nation | population | popratio |
+--------+------------+----------+
| SKorea |   50423955 |        1 |
| Iran   |   77775100 |        1 |
+--------+------------+----------+
2 rows in set (0.00 sec)


====  모두 삭제 ====

mysql>  delete from oecd;
Query OK, 2 rows affected (0.01 sec)

mysql> select * from oecd;
Empty set (0.01 sec)


====  테이블 삭제 ====

mysql> drop table oecd;
Query OK, 0 rows affected (0.05 sec)

mysql> show tables;
+----------------+
| Tables_in_mydb |
+----------------+
| man            |
| movie          |
+----------------+
2 rows in set (0.01 sec)



